Keyword,Title,Content,Score,URL,Created_UTC
Ethereum,The Ethereum Value Proposition: Dark Horse Edition,"If you’ve been in this sub for years, you may remember a series of posts here dubbed “ethereum value proposition” back in 2021 by yours truly during an epic eth fud campaign before ETH went on its face ripping rally. 

Check the receipts, I did a multi week series in mid march 2021 and days later eth made the face melting gains 3x and up.

Why am I telling you this? To toot my own horn? No. 

It’s because the reason I made those posts years ago was because the market was being HIGHLY irrational toward ETH and I believe it is doing it again, and where irrationality exists, opportunity for gains exists as well.

If you’ve had a pulse in crypto the last 3-6 months you’ll know everyone and their mom has turned bearish on ETH. In 2021 the criticism was “EtH cAnT ScALe”, now it’s “EtH is DeD”

Nonsense. And here’s why:

Tradfi has quickly realized that the megalithic opportunity in crypto is stablecoins (see https://x.com/nic__carter/status/1857408855719674075).

As you can see stablecoin volume has skyrocketed in the last 4 years eclipsing PayPal, bitcoin, remittances, and ALMOST approaching the levels of VISA, the largest payment processor in the world.

Guess where the VAST majority of stablecoin volume happens? Yep Ethereum and it’s L2s. Over 70%.

“Oh but ETH L1 has no usage no one uses it or oh it’s L2s are dead bla bla bla.” 

No, ETH has significantly scaled by introducing “blobs” a few months back. check L2beat, Ethereum and its L2s users and transactions are near all time highs for an aggregate of ~370 TPS currently. Source: https://l2beat.com/scaling/activity

“Oh ok so some people use ETH big deal, but it’s still not a good investment”

If that were true,why then while everyone and their mom has been fudding ETH, Blackrock, (the largest hedge fund in the world)in the last 2 months has increased it’s holdings of ETH in its ETFs by a whopping 65%? Source: https://x.com/EthereanVibin/status/1858254969389863290

Why is over 95% of Blackrocks “BUIDL” fund of over 500 million dollars built on Ethereum?

Why are states like Florida and Michigan starting to acquire ETH? Florida now holds over 800 million in crypto related investments and Michigan 11 million: https://www.ccn.com/news/crypto/michigan-largest-ethereum-etf-holders-us/

“Oh but Bitcoin is the only scarce asset with real value for holders, everything else is just a scam or gambling”

Since proof of stake and the burn was implemented about 3 years ago ETH has had HALF the inflation rate of bitcoin: https://ultrasound.money/

In laymen’s terms, bitcoin is being printed at twice the rate of ETH. People literally do not realize this.
This is beyond significant.

Michael Saylor himself, the bitcoin messiah has said that bitcoin HAS to figure out a way to generate yield, because just holding it long term is not economically feasible, direct quote:

“The point is If the capital doesnt generate a return  its a non performing asset, you need to address the issue. If I put $100B into $BTC and the yield is 0%, thats just as bad as having $100B bonds that pay 0% yield. In both cases theyre non performing""

Source: https://x.com/etheraider/status/1836493170772971646

What this means is that Saylor fully recognizes that yield is KING.

Everyone knows that stocks that provide quality yield command a premium, you don’t think crypto assets will command the same premium anon?

But don’t confuse yield with inflation, yield comes from “activity/MEV/fees”, because if you have high yield due to inflation and not from actual usage of the chain, then your yield will be high but so will the inflation of your coin so you never come out ahead.

And what chain has the purest native premium on yield? The one with the most activity/mev/fees RELATIVE to its inflation, in other words Ethereum.

Saylor for a long time discredited eth because he said it was a security. Now it officially is not.
He now says he wants a “form of bitcoin” aka a scarce asset that gives him yield…..

You do the math.

Saylor may never capitulate and buy ETH due to pride or maybe because he’s built a religious cult following and attack the fragility of bitcoin maximalism by holding another asset but that doesn’t mean you have to repeat his mistake.

Is ETH the BEST asset in crypto? No, there’s no way I can make that claim about any asset without being biased or disingenuous.

Is it ONE of the best risk adjusted reward plays right now given history, tech, present social bias, and network effect?

Absolutely. 

I could go on and on about how ETH has always outperformed BTC in bull cycles, how the weekly RSI is at all time historic lows and therefore represents a legendary buying opp, etc etc

But I’ll end with this:

3 years ago the level of FUD surrounding ETH is what prompted me to post this series because it was so over the top irrational.

The same pattern is repeating now.

If you listened then and did the counter trade congrats. If you didn’t, here’s your second chance

Don’t fall for the CT FUD doomloop.

ETH is the dark horse this cycle.

Load up, you won’t regret it. ",635,https://www.reddit.com/r/CryptoCurrency/comments/1gu6bhl/the_ethereum_value_proposition_dark_horse_edition/,1731941115.0
Ethereum,"Three factors driving Ethereum to $10,000. Yes, really",,912,https://www.dlnews.com/articles/markets/three-drivers-that-will-push-ethereum-to-new-heights/,1732626340.0
Ethereum,'The Goal Of Crypto Is Not To Play Games With Million Dollar Pictures Of Monkeys': Ethereum Founder Takes Shot At Bored Ape Yacht Club,,4273,https://www.benzinga.com/amp/content/26212053,1647800226.0
Ethereum,Ethereum's cofounder Vitalik Buterin says we'll soon use 'soulbound tokens' to verify things like school and employment — all stored in a 'souls' wallet,,2575,https://www.yahoo.com/finance/news/ethereums-cofounder-says-well-soon-183542182.html,1653509984.0
Ethereum,"This outrage is insane, BUT, Ethereum and Bitcoin are still... working.","Yeah, banks went down... airplane companies went down... 911 went down and many many many other things went down. But, crypto... Ethereum and Bitcoin (Solana probably went down too) are still up and running. There's absolutely no DISTURBANCE in the Ethereum nodes. And this makes Ethereum and other currencies the future of money! Nothing can stop them and I think this proves why Ethereum is really important for the future.

  
I think today, was an amazing day for cryp...I mean Ethereum! Ethereum is truly a world's currency and we just forcefully realized how much we need ETH! ",850,https://www.reddit.com/r/CryptoCurrency/comments/1e73ll6/this_outrage_is_insane_but_ethereum_and_bitcoin/,1721395267.0
Ethereum,"Ethereum Finally Breaks All-Time High of $1,400!",,5444,https://decrypt.co/54562/ethereum-price-breaks-all-time-high-of-1400,1611056294.0
Ethereum,"Ethereum’s $4,000 Hope Diminishes as Dominance Hits a 4-Year Low",,581,https://beincrypto.com/ethereum-dominance-falls/,1737140179.0
Ethereum,Ethereum surpasses Bitcoin as the most popular cryptocurrency on YouTube,,5050,https://londonlovesbusiness.com/ethereum-surpasses-bitcoin-as-the-most-popular-cryptocurrency-on-youtube/,1617964612.0
Ethereum,Ethereum is like ‘Amazon in the 1990s’ — 21Shares,,443,https://cointelegraph.com/news/ethereum-is-still-like-amazon-in-the-1990s-21-shares,1730688381.0
Ethereum,Crypto community donates over $1.7 million in Ethereum and ERC20 tokens towards India's coronavirus fight,,6201,https://cryptoslate.com/ethereum-creator-vitalik-buterin-donates-640000-towards-indias-coronavirus-fight/,1619426300.0
Ethereum,Just paid off my mortgage 20 years early and placed an order for my dream car. Thank you Ethereum!,"Long time lurker here. I've been in crypto for the last 4 years. In 2017 I held all the way through the bull market and then sat and watched my portfolio shrink to nothing as I was convinced the bull run had not finished. 

Fortunately I was patient enough and endured the whole bear market and yesterday with the new ATH of ETH I was able to sell enough to pay off my mortgage and place an order for my dream sports car.

I havent spoke on here much but I have lurked in the shadows from the start. Your posts and memes have got me through the bad times and helped me keep hold of my portfolio. Thank you to you all and I hope you are all in a similar situation!",4840,https://www.reddit.com/r/CryptoCurrency/comments/lbj8qh/just_paid_off_my_mortgage_20_years_early_and/,1612341472.0
Ethereum,"How much will the price of Ethereum move by Monday, May 3rd? ","Reference price: $2,509.37

[Data will be sourced from CoinGecko](https://www.coingecko.com/en/coins/ethereum)

**FILTERING CRITERIA: 1w, USD, Linear Chart, Close Chart**

Winning results will be based on the price **at 12 pm PDT on May 3rd.** Results of the prediction will be revealed **between 11:59 AM PDT and 11:59 PM PDT the day after the prediction date.**

[View Poll](https://www.reddit.com/poll/mz2wfk)",6633,https://www.reddit.com/r/CryptoCurrency/comments/mz2wfk/how_much_will_the_price_of_ethereum_move_by/,1619457804.0
Ethereum,PayPal Lets Users Transfer Bitcoin and Ethereum to External Wallets,,3474,https://decrypt.co/102210/paypal-lets-users-transfer-bitcoin-and-ethereum-to-external-wallets,1654615553.0
Ethereum,Get ready for Ethereum supply shock,"Since August 5, over 489,000 ETH has been burned. This is about $1,750,000,000 worth of Ethereum. Ethereum has also been consistently seeing deflationary days. Not only this, but Ethereum is also close to a triple halving. Perhaps the most bullish thing is that Crypto exchanges are running out of Ethereum.

&#x200B;

[ETH On Exchanges at their lowest level](https://preview.redd.it/smgzr8ne3is71.png?width=447&format=png&auto=webp&s=7925437721a3fa86a0a8934d0c4b13fb79fa5fa9)

And guess what? This is not even the biggest news for Ethereum. Ethereum layer 2 is also promising 100x gas cuts and is expected to be live by November. This is incredibly bullish for Ethereum. We can easily expect one of the largest bull runs ever if this keeps continuing. Miners are also losing momentum too. With Ethereum being burned more and more and exchanges almost running out soon, I'd say get ready for a supply shock soon.",2527,https://www.reddit.com/r/CryptoCurrency/comments/q4nwqi/get_ready_for_ethereum_supply_shock/,1633794506.0
Ethereum,"Ethereum's 99.95 % drop in energy usage will be equal to 15 big nuclear reactors, or 11 000 wind turbines","The Merge will reduce Ethereum's energy impact by up to 99.95 %. That's over [110 TWh of energy saved annually](https://ethereum.org/en/energy-consumption/), or 110 billion kilowatt-hours, equal to the annual energy output of over **15 big, 800 MW nuclear reactors.** Assuming that the reactors are never taken offline :)

Wondering how many wind turbines that is? In the US, the mean capacity of wind turbines is [2.75 MW](https://www.usgs.gov/faqs/how-many-homes-can-average-wind-turbine-power): large, off-shore wind turbines can have production capacities of up to 8 MW. The typical capacity factor is 42 %.

This means, that Ethereum's energy savings are equal to the annual production of almost **11 000 wind turbines.**

Nuclear: 110 TWh / (800 MW * 24 h * 365) = 15.7

Wind: 110 TWh / (2.75 MW * 24h * 365 * 42 %) = 10870",2069,https://www.reddit.com/r/CryptoCurrency/comments/xbrukh/ethereums_9995_drop_in_energy_usage_will_be_equal/,1662925822.0
Ethereum,Ethereum co-founder moves $72 million in ETH to Kraken,,735,https://cryptoslate.com/ethereum-co-founder-moves-72-million-in-eth-to-kraken/,1732977716.0
Ethereum,Ethereum creator Vitalik Buterin says Crypto price crashes Like Terra’s (LUNA) are good for Crypto because it exposes unsustainable business models,,3116,https://dailyhodl.com/2022/09/03/ethereum-creator-vitalik-buterin-says-crypto-price-crashes-like-terras-luna-are-good-for-crypto-heres-why/,1662243434.0
Ethereum,"For anyone on the fence due to the recent BNB price spike, BSC is just Ethereum with a higher gas limit at the expense of centralization. Don't be fooled into thinking it's better or that Ethereum is ""outdated tech"", Ethereum has the most developers working on improving it by a very wide margin.","I've noticed a lot of people suggesting Ethereum is outdated tech and that BNB is the future because it has lower fees. That couldn't be further from the truth.

BSC is an Ethereum clone and all they did to reduce fees was increase the gas limit. That means that more transactions can be processed for lower fees but it requires more powerful hardware and thus more centralization. Ethereum could do this in 10 minutes if they thought that was beneficial to the network but they haven't because doing so would break a lot of the decentralization and security of the network.

Ethereum is so widely used and trusted **because** it is so decentralized and secure.

Ethereum has the most developers and researchers working on it than any other blockchain project by a very long way which means it is literally the bleeding edge of crypto tech. The Eth killers have a long way to go to knock it off as king of DeFi.

That's not to say that ADA and DOT aren't very promising projects but putting BSC/BNB in with them is almost laughable. It's just a clone! It will always be behind.

Check out Ben Cowen's recent [fundamentals video](https://www.youtube.com/watch?v=NguprqQyUDo) to understand a bit more.",2966,https://www.reddit.com/r/CryptoCurrency/comments/mlcja7/for_anyone_on_the_fence_due_to_the_recent_bnb/,1617718249.0
Ethereum,Ethereum creator Vitalik Buterin donates $5 million in ETH to aid Ukraine,,4686,https://finbold.com/ethereum-creator-vitalik-buterin-donates-5-million-in-eth-to-aid-ukraine/,1649324252.0
Ethereum,Ethereum’s Daily Active Addresses Surpass Bitcoin for the First Time in Crypto History,,3747,https://blockchain.news/analysis/ethereum-daily-active-addresses-surpass-bitcoin-the-first-time-crypto-history,1624960624.0
Ethereum,Ethereum Spot ETFs Approved by SEC,,961,https://coinmarketcap.com/community/articles/664faf58874f041f6cbac295/,1716498737.0
Ethereum,"Ethereum breaks the $2.000 barrier again after 242 days, as the Shapella upgrade goes live!"," In the last few months, Ethereum, and Crypto in general started to take off again. BTC went from $17k to now $30k, an almost 80% increase, in just 3 months, and equally Ethereum has risen from $1.2k to now $2k, which was hit 20 minutes ago.

The jump in the Ethereum price was of course driven by the Shapella upgrade, that went live 14 hours ago. This upgrade is Ethereum's biggest milestone since the merge, and it aims to enable validators of the Ethereum blockchain to successively withdraw their staked Ether. Also, transaction fees for certain activities on the network have been optimized.

Personally, i am really exited about the future and Ethereum and still see huge potential in a potentially upcoming bullrun in the Future. I could easily see it well above $10k in a few years, but only time will tell. Exited to hear your thoughts!",1623,https://www.reddit.com/r/CryptoCurrency/comments/12kpftz/ethereum_breaks_the_2000_barrier_again_after_242/,1681392922.0
Ethereum,Can Cardano Become The Third Biggest Crypto After Ethereum And Bitcoin?,,2588,https://dailycoin.com/can-cardano-become-the-third-biggest-crypto-after-ethereum-and-bitcoin/,1620908729.0
Ethereum,Ethereum Chain Splits Due to Bug: Devs Urging Users to Avoid any ETH Transactions,,2337,https://cryptopotato.com/ethereum-chain-splits-due-to-bug-devs-urging-users-to-avoid-any-eth-transactions/,1630095129.0
Ethereum,"Bank of Israel adopts Ethereum for digital shekel trial, and there’s more.","https://en.globes.co.il/en/article-bank-of-israel-adopts-ethereum-for-digital-shekel-trial-1001375607


So Globes is considered serious news source, and I found some key points from this article worth mentioning, it’s the little things in the article that excites me…

“This technology is being used in other trials conducted by central banks worldwide including in Australia, Hong Kong and Thailand.”

In the Hebrew version there’s a little more info.. 
https://www.globes.co.il/news/article.aspx?did=1001375518&fbclid=IwAR0q6mfGSFtbEk_ZYjbNqmWhWhyaHW06f7orWgDsQPhy77HC0r-vPyippCA

“About 74% of the world banks are in the process of adopting and experimenting with cryptocurrency pilot programs”…

Worldwide adoption? This is big 👏👏",3325,https://www.reddit.com/r/CryptoCurrency/comments/oe0fh6/bank_of_israel_adopts_ethereum_for_digital_shekel/,1625462313.0
Ethereum,Ethereum’s Vitalik Buterin Says Cardano (ADA) Is Introducing Fresh Ideas to the Crypto Space ((Any chance we could stop with the ETH vs. ADA bull? Go read his quotes. The truth is actually more nuanced)).,,2992,https://heraldsheets.com/ethereums-vitalik-buterin-says-cardano-ada-is-introducing-fresh-ideas-to-the-crypto-space/,1623504293.0
Ethereum,Ethereum Gas Prices Plummet 93% to Reach Rock-Bottom Levels,,861,https://dailycoinpost.com/ethereum-gas-prices-plummet-93-to-reach-rock-bottom-levels/,1715597012.0
Ethereum,Vitalik Buterin Says Ethereum Merge Cut Global Energy Usage by 0.2%,,1935,https://www.binance.com/en/news/flash/7202406,1663295918.0
Ethereum,The top post about the Ethereum supply shock is a misleading.,"Hello everyone,

There's a popular post on this subreddit that warns of an incoming Ethereum supply shock.

I would just like to point out that the graph is a bit misleading. Yes, the Ethereum reserve in exchanges is dropping, but the post makes it seem far more dramatic than it is.

Here's the link to the graph :

https://cryptoquant.com/overview/eth-exchange-flows/278


The post (intentionally or not) omits the left axis, which clearly shows that the supply on exchanges went from 24M to 18M. 

Without the left axis, it would look like the reserves are dropping to zero, which is far from reality.

I just wanted to point this out for a clearer image. 

People shouldn't blindly trust the information given to them, and always do your research. Your hard earned money is on the line.",2935,https://www.reddit.com/r/CryptoCurrency/comments/q4sx5r/the_top_post_about_the_ethereum_supply_shock_is_a/,1633809954.0
Ethereum,Ethereum Price breaks $3600 Flashes Signal That Could Trigger a New All-Time High,,788,https://bitcoinist.com/ethereum-eth-price-flashes-signal-that-could-trigger-a-new-all-time-high-before-new-year-but-one-eth-killer-will-shine-brighter/,1732745362.0
Ethereum,Whale loses $24 million worth of ethereum to a phisher. This might be the largest amount phished from a single person,"Wallet loses $24.2 million worth of crypto, most of them in LSDs including 4851 reth and 9579 steth. 

The transaction link in which the whale gets drained of his staked ether - https://etherscan.io/tx/0xcbe7b32e62c7d931a28f747bba3a0afa7da95169fcf380ac2f7d54f3a2f77913

The first question we will all have is ""how did this happen?"" 

> The victim gives an approval to the scammer by signing increase allowance transactions through this transaction - https://etherscan.io/tx/0xbb4fe89c03d8321c5bfed612fb76f0756ac7e99c1efaf7c4d99d99f850d4de53

This isn't the first time the phisher has successfully phished victims, they have a long list if previous victims. One of the scammers address is 0x4c10a462CD1e639Da8A062aE8a33a23401120ab1 which is associated with atleast 10 crypto phishing sites. 

Source - https://twitter.com/realScamSniffer/status/1699605356740305198?t=sYFCsnjGUbL-LixPE1iDeA&s=19",967,https://www.reddit.com/r/CryptoCurrency/comments/16c5ds0/whale_loses_24_million_worth_of_ethereum_to_a/,1694058124.0
Ethereum,"Why Bitcoin, Ethereum, and Solana Price Crashed, Triggering $950 Million in Liquidations",,709,https://dailycoinpost.com/why-bitcoin-ethereum-and-solana-price-crashed-triggering-950-million-in-liquidations/,1713001042.0
Ethereum,Ethereum Co-Founder Vitalik Buterin Calls Bitcoin Cash a Failure,,1971,https://cryptosnewss.com/ethereum-co-founder-vitalik-buterin-calls-bitcoin-cash-a-failure/,1641115402.0
Ethereum,Crypto investors hold breath as $200 billion at risk in Ethereum merge,,1673,https://www.standard.co.uk/business/crypto-investors-hold-breath-as-usd200-billion-at-risk-in-ethereum-merge-b1023563.html,1662479305.0
Ethereum,"65% of working Americans are willing to be paid in Bitcoin, Ethereum, and Dogecoin",,2569,https://cryptoslate.com/65-of-working-americans-are-willing-to-be-paid-in-bitcoin-ethereum-and-dogecoin/,1632786175.0
Ethereum,Bitcoin to Hit $200k And Ethereum to $7k in 2025,,420,https://coinedition.com/bitcoin-to-hit-200k-and-ethereum-to-7k-in-2025-bitwise/,1735401568.0
Ethereum,"In 24 hours, we will have the last ethereum update before The Merger. Still can't believe we have come this far.","In about 24 hours we will have the last Ethereum update before the merger to proof of stake from proof of work. A true milestone not only for Ethereum but for all of Crypto as this has been one of thr most anticipated events in crypto ever (maybe the most) and it's gonna have in just a few days... 

Still can't believe that we have come this far it always seemed like we will never get this update after so many delays. But now on the Sep 15th it's finally here. Even if it's overhyped now it's truly something special here.",1890,https://www.reddit.com/r/CryptoCurrency/comments/x6hho5/in_24_hours_we_will_have_the_last_ethereum_update/,1662387927.0
Ethereum,Ethereum’s energy switch saves as much electricity as entire Ireland uses | The success of The Merge concept may now serve as a roadmap to enable a switch from Proof of Work to Proof of Stake in Bitcoin.,,1303,https://interestingengineering.com/innovation/ethereums-energy-rescue-formula,1670419327.0
Ethereum,Why do people think that Cardano is faster than Ethereum?,"OK can we please have a technical discussion regarding the scalability of Cardano? Instead of the regular super highly upvoted moontalk (I know this thread will probably be downvoted to oblivion).

Cardano currently only handles 7 transactions per second on-chain. Ethereum currently handles 12-15 transactions per second on-chain. By tweaking some parameters in the future Cardano could potentially scale to 50 transactions per second on-chain which obviously still isn't enough for real world adoption. Cardano will scale off-chain with layer 2 solutions (Hydra). But they are awfully behind their competition in developing layer 2 support.

Don't take my word for it, even Cardano devs on their own subreddit admit all this.

See here: [https://np.reddit.com/r/CryptoCurrency/comments/mxjf0w/psa\_cardano\_ada\_runs\_at\_seven\_7\_transactions\_per/](https://np.reddit.com/r/CryptoCurrency/comments/mxjf0w/psa_cardano_ada_runs_at_seven_7_transactions_per/)

And here: [https://np.reddit.com/r/Cardano\_ELI5/comments/la7ptu/how\_many\_transactions\_per\_second\_tps\_can\_cardano/?utm\_source=share&utm\_medium=ios\_app&utm\_name=iossmf](https://np.reddit.com/r/Cardano_ELI5/comments/la7ptu/how_many_transactions_per_second_tps_can_cardano/?utm_source=share&utm_medium=ios_app&utm_name=iossmf)

So why do so many people think that Cardano is faster than Ethereum?

Also, I made this same post intended to discuss the scalability of Cardano two days ago. It quickly rose into the top 50 posts until a bot deleted it from the frontpage stating ""there are already 2 posts about this coin in the top 50"". But guess what, there are always 2 non-critical moonboy posts about Cardano in the top 50. So it's very unfortunate that technical discussions about this coin have no place on [r/CryptoCurrency](https://www.reddit.com/r/CryptoCurrency/). I will therefore keep posting this daily, until the day a bot doesn't delete it.

Edit: Since this time, this post didn't get deleted, I will add this. I have nothing against Cardano. But I have noted that there currently exists a widespread lack of knowledge regarding the scalability of blockchains in general and Cardano in particular. This is an extremely hard technical problem that haven't been solved for over 10 years. Cardano is not offering a unique quick fix to this anytime in the near future. But I am happy that we now have more projects than ever (including Cardano) that are working on it.",2107,https://www.reddit.com/r/CryptoCurrency/comments/nonoj6/why_do_people_think_that_cardano_is_faster_than/,1622418540.0
Ethereum,"World Liberty Financial ""Secretly"" Accumulated $47M in Bitcoin (BTC) and $100M+ in Ethereum (ETH)",,522,https://www.reddit.com/gallery/1i6072q,1737405024.0
Ethereum,Ethereum cryptocurrency completes move to cut CO2 output by 99% | Cryptocurrencies,,1887,https://www.theguardian.com/technology/2022/sep/15/ethereum-cryptocurrency-completes-move-to-cut-co2-output-by-99,1663241215.0
Ethereum,"BlackRock ETF Leak Triggers Bitcoin Price Surge Past $45,000 After Goldman Sachs Issues Huge 2024 Ethereum, XRP, Solana And Crypto Prediction",From the article: “Bitcoin price is set to close out the year as one of the best-performing assets after gaining around 160% thanks to soaring expectations that Wall Street giant BlackRock is about to blow up the bitcoin market”,1335,https://www.forbes.com/sites/digital-assets/2024/01/01/its-going-to-be-wild-goldman-sachs-suddenly-joins-the-bitcoin-etf-cointucky-derby-with-huge-2024-ethereum-xrp-solana-and-crypto-price-prediction/?sh=6271840d5e64,1704166959.0
