Keyword,Title,Content,Score,URL,Created_UTC
Ethereum,"“Ethereum is Useless and will Die because of Insanely High Gas Fees!” Is this you? Here is a Guide: How to Move your Ethereum/ERC-20 to Layer 2/Sidechain and do Transactions costing LESS <$0,01 taking 1-2 seconds!","Understandably most people new to this space and Ethereum, are **raging** and fearful with the current gas fees (transaction fees), having sky-rocketed lately. Yes, we are frequently seeing 100 – 300 gwei resulting in **50-150 dollar prices on Ethereum's Mainnet (Layer 1) at rush hour!**

**This post will help you out!**

1. Mainnet: **Why are the gas fees high?**
2. Mainnet: **How can I pay the LEAST POSSIBLE on Ethereum Mainnet?**
3. How solve this problem, by **moving from Ethereum’s Mainnet** to Layer 2’s (L2), Side Chains or Helper Chains that most “veterans” have been using for DeFI and transactions for months. Examples are: **Polygon, Fantom, xDAI, Optimism and soon Arbitrum**. (Polygon and Fantom not being ""true
4.  The **Layer 2 Rollups** will **Scale Ethereum** to new heights 

**REPOST FROM YESTERDAY:** The previous [Original Post](https://www.reddit.com/r/CryptoCurrency/comments/phcroe/ethereum_is_useless_and_will_die_because_of/) from yesterday and the repost was automatically removed by ModBot. Many msg me to repost, so here it is. Hopefully it stays up!

# 1) Why are the gas fees high?

* Right now, Ethereum can handle about **30 transactions per second (TPS**) at best; Visa, by contrast, does about 1,700 transactions per second and claims it can handle up to 24,000.
* Currently, due to the massive usage (**success/adoption**) of Ethereum being used for DeFI, NTFs mints (crazy shit), transactions by retails, institutions and exchanges the gas fees are rocketing in periods.
* This is bad for us “small fish”, leading to fees higher than some of us have in our wallet! However, this proves that Ethereum still is working securely even under pressure without mistakes. For sure, Ethereum needs to continue to prove that blockchain and smart-contracts are secure and decentralized, in order for adoption, acknowledgment and success of the rest of the crypto space with so **fantastic projects like ADA, ALGO, AVAX, Elrond, Tezos and ONE** etc. can thrive.
* While we wait for ETH 2.0’s Sharding and the current L2 Rollups to take over (see below), we have to look at other tricks and solutions. Besides, I suspect the completion/integration of Sharding to take longer than expected.

# 2) How can I pay the least possible gas on Ethereum Mainnet?

* Use a [Gas Tracker](https://etherscan.io/gastracker) to see the current estimated gas price for a **fast, average or slow transaction,** BEFORE transacting. If you are using e.g. [Metamask](https://metamask.io/), you can **Edit Gas Price** if it is set too high or if you believe it will drop. **Careful:** *If you set it too low*, there is a risk it wont go through, and you got to pay MORE to speed it up.
* In my experience the **gas is LOWEST in the mornings at 6-10 UTC (US night time)**, or especially in **Weekends.**
* If your transaction is not urgent, **WAIT** for the time when it drops back to **GOAL OF 15-35 gwei**! Not many weeks ago it was consistently 7-15 gwei in low traffic hours.

# 3) Make the move from Ethereum Mainnet (Layer 1) to a Layer 2 or Sidechain:

**USEFUL INFO:**

* [Layer 2/Rollups](https://ethereum.org/en/developers/docs/scaling/layer-2-rollups/)**:** Is a collective term for solutions designed to help scale Ethereum by handling transactions off the Ethereum Mainnet (Layer 1), while taking advantage of the robust security of Mainnet.
* [Sidechains:](https://ethereum.org/en/developers/docs/scaling/sidechains/) A sidechain is a separate blockchain which runs in parallel to Ethereum Mainnet and operates independently.
* **EDIT:** Doing this primarily for those who wanna use DeFi/dApps! No reason to move if you have just wanna HODL your Eth or keep them in a ""earn"" wallet like Celcius, Blockfi, Nexo or crypto . com.
* Moving to the currently most used solution, **Polygon (MATIC),** will for many be like **being born anew** (seriously, [here is my reaction/post](https://www.reddit.com/r/CryptoCurrency/comments/mxrw09/i_just_tried_maticpolygon_l2_for_ethereum_why_did/) 4 months ago). Transactions **cost average $0.0007** and **takes 1-3 seconds** (unless rush hour). Yes, this is already a lot cheaper than almost all L1 competitors.
* Polygon currently already has most big DeFi dApps like **[Opensea](https://support.opensea.io/hc/en-us/articles/1500012889322-How-do-I-purchase-NFTs-on-Polygon-) (free trading of NFTs), Sushiswap, 1inch, AAVE, Curve, Beefy**. And many more are integrating.
* Polygons biggest DEX is [Quickswap](https://quickswap.exchange/#/swap), it's based on Uniswap V2. It has 1 Billion TVL and 24 h volume +/- 100 million. In other words: Great liquidity!
* [Coinbase and other Exchanges are integrating Polygon](https://www.fxstreet.com/cryptocurrencies/news/coinbase-to-use-polygons-ethereum-scaling-solution-to-reduce-prices-settlement-times-202109010427), so, you soon you can deposit DIRECTLY into e.g. Polygon, and Withdraw directly without having to touch L1's high fee baselayer!
* Another great choice is **Fantom (FTM),** while being it’s own blockchain is compatible with EVM and can be regarded as a helper chain.

**HOW TO:**

* For simplicity, we will focus on Polygon. In order to move to or from Polygon, you need to use this [Bridge](https://wallet.matic.network/bridge/) (there are loads of other bridges too, e.g. between BSC or Fantom).
* I personally connect with [Metamask](https://metamask.io/) (signing all transactions with my hardware wallet [Ledger](https://www.ledger.com/)/[Trezor](https://trezor.io/)for security!) or Coinbase wallet to interact with Bridges and dApps. You can easily add different networks ([handy link to do it automatic](https://chainlist.org/)) supporting the Ethereum Virtual Machine (EVM) and seamlessly swap between them in your Metamask, after you’ve added them.
* If you use bridge when **we're at 15-25 gwei,** I recon moving e.g. Eth costs like **$3-5 for permission**, then **$7-10 for Transfer.** With current gas prices it's surely >**$**100!

&#x200B;

[Pretty easy to use.](https://preview.redd.it/iijnvxf6uil71.png?width=1917&format=png&auto=webp&s=4b8781401125348fd9808baee844b21b563c6f3f)

1. Chose what and where you want to transfer, and... click transfer.
2. From Ethereum L1 to Polygon, you **first need to pay a 1 time ""permission to use"" transaction** for **each new coin** (it gives permission to the bridge smart contract to use your selected token e.g. Eth, AAVE, LINK). This is cheaper than the actual transfer.
3. When the first transaction is done, you will get prompted to do the **actual Transfer** (higher price). Again, wait until gas fees are low to start the Bride-process, but when it's done you're FREE.
4. Once your crypto arrives at Polygon, **you automatically get some free MATIC that lasts many transactions** (Cant remember, it's 0.01?). You can also use a [faucet](https://matic.supply/) if you run out of gas. I typically just buy 1 MATIC for all my accounts, which will hold for probably 1000 transactions.

# 4) The Layer 2 Rollups will Scale Ethereum to new heights

* Ethereum 2.0 will in the future have it’s **sharding, however I believe the the current working and coming L2/Rollups** will easily scale to >100,000 TPS. Heck even 1 of the current Rollups alone has far better TPS than many of the current L1-competitors!
* There are 3 types of rollups. **ZK-rollups** (Zero Knowledge rollups), **Optimistic rollups** and **Hybrids.**
* **ZK-rollups** bundle or ""roll up"" hundreds of transfers off-chain and generates a cryptographic proof, known as a SNARK (succinct non-interactive argument of knowledge). This is known as a validity proof and is posted on layer 1. Examples of Rollups being built are: **Loopring, Starkware, Matter Labs zkSync, Aztec 2.0, Hermez network** (merged with Polygon), **zkTube**
* **Optimistic rollups** sit in parallel to the main Ethereum chain on layer 2. They can offer improvements in scalability because they don't do any computation by default. Instead, after a transaction they propose the new state to Mainnet, or ""notarise"" the transaction. With Optimistic rollups, transactions are written to the main Ethereum chain as calldata, optimising them further by reducing the gas cost. Examples are: **Optimism** (Live!), **Arbitrum** (Live!)**, Fuel Network, Cartesi and OMGX.**
* In some years **Ethereum will be a beast,** a platform hosting the web3 as a base later, having multiple L2 rollups, sidechains, helper-chains working on top of it, in addition to **Sharding**, making it able to host the necessary thousands or millions of TPS needed for mass adoption.

**If you enjoyed this post, feel free to check out 2 of my recent other educational posts:**

* Guide: [How to start Compounding Crypto by Staking, Lending or Liquidity Providing](https://www.reddit.com/r/CryptoCurrency/comments/pf6qq7/how_to_start_compounding_crypto_by_staking)
* Guide: [How to Make Exit Strategies and Taking Profit if you dare](https://www.reddit.com/r/CryptoCurrency/comments/pdgsn5/lets_talk_about_exit_strategies_and_profit_taking)

**EDIT 1:** **Binance** and **Kucoin** provides direct withdrawal of MATIC token to Polygon Network. **Crypto.com** has USDC transfers directly to Polygon. **OKEX** already supports Arbitrum. More exhancges are integrating the Rollups as we speak. Thanks to: Warlikeofthechaos, anor_wondo, steamyp and DamnAutocorrection!

**EDIT 2**: Yes you are probably right, in a couple of months or more, I think most of Ethereums L1 traffic have moved (bridged) to the fast and cheap newly launched/WORKING L2 Rollups like **Arbitrum** and **Optimism**!",1335,https://www.reddit.com/r/CryptoCurrency/comments/phvtva/ethereum_is_useless_and_will_die_because_of/,1630776608.0
Ethereum,What Is Loopring? An Ethereum Tool for Decentralized Exchanges and Payments,,1208,https://decrypt.co/resources/what-is-loopring-ethereum-tool-decentralized-exchange-payments,1652812563.0
Ethereum,Ethereum’s gas fees ARE a problem. No matter what you think.,"Trust me, I’m an Ethereum fan more than anyone. But what I hate is that people aren’t ready to hear hate about their favorite crypto.

Even at a low of $5 right now. Ethereum’s fees are way too high than it should be - like Vitalik once said “the internet of money should not cost 5 cents a transaction.”

$5 is 100x more than 5 cents.

Hopefully L2 solutions are able to fix that problem or Ethereum 2.0 can by moving to PoS.

Whichever way, if they manage to succeed with solving this problem. Ethereum will be the biggest thing since sliced bread.",908,https://www.reddit.com/r/CryptoCurrency/comments/rtomon/ethereums_gas_fees_are_a_problem_no_matter_what/,1641060103.0
Ethereum,"Ethereum Is Not Done: Crypto Analyst Sets New $5,000 Target",,575,https://www.newsbtc.com/news/ethereum/ethereum-new-5000-target/,1710351052.0
Ethereum,The Creator Of Ethereum Was Unwittingly Gifted Half Of A Dog Meme Cryptocurrency. That Gift Is Now Worth $8 Billion,,1474,https://www.celebritynetworth.com/articles/billionaire-news/ethereum-co-creator-vitalik-buterin-is-now-a-billionaire/,1620654304.0
Ethereum,"Lead ETH dev makes ""ominous"" thread about Ethereum. Not sure what to make of it...but it doesn't sound good. Any useful insights on this?","
Péter Szilágyi (karalabe.eth)
@peter_szilagyi
Mar 18  

Complexity is an often overlooked aspect of a system because usually someone else is paying the price for it, not the person creating it.

But don't be mistaken, someone *is* paying the price - whether money, time or mental capacity. They might not be willing/able to do forever.  

As with scalability, complexity also keeps trickling unseen up to the breaking point. At that time, it's already past the point of no return.

Complexity also has the nasty effect of causing cascading failures. Overload people too much, lose capacity, leading to even larger load.  

In #Ethereum's history, complexity never decreased. Every EIP is piling on top. Every major change (1559, merge, sharding, verkle, stateless, L2, etc) is one more nail.

I'm extremely frustrated when a research proposal says ""everything's figured out, it's just engineering now"".  

As good as it feels that we're approaching The Merge, I must emphasize that #Ethereum is not going in a clean direction. Tangentially it's achieving results, but it's also piling complexity like there's no tomorrow.

If the protocol doesn't get slimmer, it's not going to make it.  

I feel the root cause is the disconnect between the research and the dev teams. The former has to ""only"" dream up elegant - standalone - ideas.

The latter needs to juggle every single idea that was ever introduced, whilst surgically expanding the dimensionality of the space.  

There have been engineering attempts to reduce the complexity (module split in Erigon, responsibility split in The Merge). Yet there was never an attempt to reduce the protocol complexity.  

We are already past the point of anyone having a full picture of the system. This is bad.  

I can't say what the solution is, but my 2c is to stop adding features and start culling, even at the expense of breaking things.

There are less and less people knowing and willing to piece together a broken network. And each change pushes more away. /FIN  


LINK to the thread itself: https://nitter.net/peter_szilagyi/status/1504887154761244673#m",908,https://www.reddit.com/r/CryptoCurrency/comments/tj82mi/lead_eth_dev_makes_ominous_thread_about_ethereum/,1647856091.0
Ethereum,Ethereum is now more valuable than any bank or payment system in the world (besides BTC),,1450,https://companiesmarketcap.com/assets-by-market-cap/,1636375505.0
Ethereum,"Bitcoin Hits $20K, Ethereum Rises 12% as Crypto Market Cap Tops $1 Trillion",,860,https://decrypt.co/112868/bitcoin-ethereum-price-crypto-market-cap-1-trillion,1666750240.0
Ethereum,Ethereum Whale sells minutes before market crash. Saves $5 Million,,551,https://cryptonewsbytes.com/this-ethereum-whale-saved-5-million-a-minute-before-the-crypto-market-crashed/cryptocurrency/,1692483079.0
Ethereum,"Ethereum has outperformed Bitcoin by 460% in number of transactions, but sending BTC has been 3.5x cheaper: A view on 2023 data so far","I've gathered Jan-Feb 2023 data from both blockchains to see how the two biggest hounds in the shed are performing in terms of number of transactions and their costs.

For BTC, I've used Nasdaq data. For ETH, I've used etherscan's native data. Data was taken from 1st Jan 2023 to 28th Feb 2023.

Note: This analysis **does not** include L2 contributions, as this is not available on etherscan (at least not that I could find).

# ETH surpassed BTC by 460% in number of transactions

That's pretty much the summary on transactions. The totals in transactions so far are:

**BTC: 17,146,792**

**ETH: 61,654,763**

This is expected as there are way more things happening in the ETH chain, such as tokens, digital collectibles etc. An overview of the data is below:

[Values in the y-axis is in millions of transactions](https://preview.redd.it/0jq059npa5la1.png?width=1800&format=png&auto=webp&s=32788fbd2774d4126176d369ee3db4fbb651ff90)

# Sending BTC has been ~3.5x cheaper than sending ETH

The average fees per transaction are:

**BTC: $1.28**

**ETH: $4.47**

I've divided the amount of fees paid in a day by the number of transactions in that day for BTC. ETH's data already comes in averages. Charts are below:

https://preview.redd.it/5c28h70s95la1.png?width=1800&format=png&auto=webp&s=c3dc0586833540396ea48e8be6d832dca7e49ab7

# TL;DR

Since 1st Jan 2023, Bitcoin's blockchain settled 17,146,792 transactions at an average cost of $1.28 per transaction. Ethereum's blockchain (L1) settled 61,654,763 transactions at an average cost of $4.47 per transaction.

Values are expected since ETH's blockchains have plenty of stuff happening at the same time.",868,https://www.reddit.com/r/CryptoCurrency/comments/11f78vi/ethereum_has_outperformed_bitcoin_by_460_in/,1677685977.0
Ethereum,Kim Kardashian Has Been Reported By a Redditor to the SEC for Profiting from the EthereumMax ‘Scam’,,1548,https://m.investing.com/news/cryptocurrency-news/kim-kardashian-has-been-reported-to-the-sec-for-profiting-from-the-ethereummax-scam-2615451,1631617918.0
Ethereum,Vitalik Says Ethereum Must Achieve Mainstream Adoption Within Five Years,,404,https://thedefiant.io/vitalik-says-ethereum-must-achieve-mainstream-adoption-within-five-years,1711116085.0
Ethereum,Yesterday marked the first Project to officially move from Ethereum to Cardano. SingularityNET has moved citing transaction speed and cost as a compelling reason to go to Cardano.,"Between May 28 and the 31st, all AGI tokens in exchange wallets or held on Ledgers etc will be converted from AGI to AGIX, so that they can run natively on Cardanos blockchain.  

This is the first project to have completed a move and I think as we have a date now for Smart Contracts (end of August) it will be the first of many.  

While ETH 2.0 will be cheaper and faster than Ethereum is now, there’s still a compelling case for projects to use the ERC-20 converter, move over to Cardano and enjoy cheaper fees, faster transactions, energy efficient network and have their token represented natively with all the same rights and priorities on the network as ADA.  

Charles Hoskinson claims there are just over 100 projects looking to move from Eth to Cardano as more functionality is added in the coming months. Whether that number changes due to updates in Ethereum 2.0’s development remains to be seen.",1155,https://www.reddit.com/r/CryptoCurrency/comments/nnjwj0/yesterday_marked_the_first_project_to_officially/,1622281029.0
Ethereum,"The bulls are back baby, and Ethereum is taking over the pairing business on exchanges... it's about time!","Ethereum is fucking killing it right now, and the fact that Bitfinex has added complete trading pairs with all of its coins and tokens has a lot to do with it, so I really hope all the other exchanges out their start doing the same!

I don't know about you guys, but I never ever use Bitcoin to do anything, and only use Ethereum or Litecoin when I need to transfer and trade, and I'm pretty sure all of you do as well.

Once they pair Ethereum with everything, it will not only save us time, but money as well, because we won't have to transform whatever we used to transfer quickly back into Bitcoin, in order to buy what we want... a win win!

Although, I see this as a very bad thing for Bitcoin though, because what would we need it for if or when this happens... time will tell I guess.

Your thoughts?",1648,https://www.reddit.com/r/CryptoCurrency/comments/7tjze9/the_bulls_are_back_baby_and_ethereum_is_taking/,1517142427.0
Ethereum,It looks like Ethereum is now deflationary as the burn rate is at least 5% higher than the reward,,817,https://etherscan.io/blocks?p=1,1663364236.0
Ethereum,"Bitcoin slips 10% to touch $20,000, Ethereum down 15%.",,924,https://decrypt.co/102963/bitcoin-down-10-percent-20000-ethereum-down-15-percent,1655288516.0
Ethereum,"Ethereum Eyes $10,000 as ""Second Bull Run"" Takes Shape — Analyst",,343,https://zycrypto.com/ethereum-eyes-10000-as-second-bull-run-takes-shape-analyst-claims/,1732806759.0
Ethereum,"2025 Bull Run: Analyst Predicts Bitcoin at $250K, Ethereum at $15K",">$BNB: $1,000-$1,400

>$SOL: $450-$650

>$XRP: $3-$5

>$DOGE: $1

>$LINK: $250-$500

",252,https://www.banklesstimes.com/news/2024/08/01/2025-bull-run-analyst-predicts-bitcoin-at-250k-ethereum-at-15k/,1722533903.0
Ethereum,Public outrage in the United States over rising gas prices. Is this it? Has Ethereum truly gone THAT mainstream?!,"I checked the news today for the first time in months, and on the front page was an article on public outrage over gas prices.  Since I'd been browsing almost exclusively crypto-related news sources for the last year and a half, I thought this was nothing out of the ordinary.  Then I realized, it was on the front page of the New York Times!

Has crypto really gone so mainstream now that people in Alabama are lining up to protest increases in gas prices?!  Haven't they heard about Layer 2 sidechains like Polygon?  Why aren't those guys up there making a statement?  This is a golden opportunity!",2309,https://www.reddit.com/r/CryptoCurrency/comments/te25a5/public_outrage_in_the_united_states_over_rising/,1647277102.0
