Keyword,Title,Content,Score,URL,Created_UTC
Bitcoin,This sub 2 months ago: You will never see Bitcoin below $50k ever again,"Two months ago when Bitcoin hit its all time high of $69k, pretty much all you would hear from people around here was that the days of Bitcoin below $50k was a thing of the past--with members posting all these ~~astrological~~ TA charts proclaiming how the 'maximum pain' from here on forward was around the $55k mark. 

But what caught my attention more than anything was all the people whining and complaining how they 'wished' they had bought in when BTC was in the low 40s and how they had missed that glorious opportunity. 

Well fellas... its time to put up or STFU cause that time is today. But judging by things around here I am guessing the modus operandi is going to be more and more whining, this time about how they 'wished' they had sold. And then a couple of weeks or months from now when the market recovers (as it always does) we'll have the same people whining about how they missed that golden opportunity of buying low yet again.. no wonder we have that prophetic joke about buying high and selling low. 

I think its about time to disrupt that problematic pattern of behavior.",5203,https://www.reddit.com/r/CryptoCurrency/comments/rzg6i1/this_sub_2_months_ago_you_will_never_see_bitcoin/,1641692609.0
Bitcoin,Ethereum hits multi-year low against Bitcoin erasing all gains since 2021,,984,https://cryptoslate.com/insights/ethereum-hits-multi-year-low-against-bitcoin-erasing-all-gains-since-2021/,1730122372.0
Bitcoin,Today is the 16th anniversary of the day Satoshi Nakamoto launched Bitcoin,,2606,https://i.redd.it/357cpk2impae1.jpeg,1735880013.0
Bitcoin,"Justin Turdeau attacks Prime Ministerial candidate Pierre Poilievre for supporting Bitcoin: ""Telling people they can opt out of inflation is not responsible leadership""",,3603,https://np.reddit.com/r/Bitcoin/comments/xcu666/justin_turdeau_attacks_prime_ministerial/?utm_source=share&utm_medium=ios_app&utm_name=iossmf,1663038371.0
Bitcoin,Ripple is funding propaganda against Bitcoin by teaming up with the government to spread energy FUD,"Ripple labs has been funding ""research"" along with government entities to spread propaganda against Bitcoin and mining. 

In 2021, they funded a hit piece that claims energy prices for consumers in New York has increased by $6 per month because of mining. 

[Claim: Mining drives up household electricity bills](https://preview.redd.it/m0ta2tae4xb81.png?width=1318&format=png&auto=webp&s=8079d16b0fde7bc74ebd204d4362ff823da26d3f)

Surely its not the soaring costs of natural gas that is driving up electricity prices, but mining? 

[Since June 2020, Natural gas prices have gone up by 350&#37; in the USA \(Henry Hub natural gas futures rolling contracts\)](https://preview.redd.it/iprxvhfj5xb81.jpg?width=2610&format=pjpg&auto=webp&s=e4da2516b82eb585706d4d1af417320b5b82889e)

[Not just in USA, in UK, natural gas is at decadal highs. ](https://preview.redd.it/v2gl6rmx3xb81.jpg?width=3094&format=pjpg&auto=webp&s=9dae03fee6dfbbfaf58df82519db809462d01254)

Surely, electricity prices that consumers pay have nothing whatsoever to do with inflation, or soaring gas prices that are in decadal highs.. but is due to bitcoin mining?!

Crude oil WTI futures are currently at 84, for comparison it was around 56 in Nov 2019 (pre pandemic). The last time WTI was above 80 was all the way back in 2014. Increasing crude oil natural gas prices, along with inflation that is at multi-decade high is not the reason for increase in household electricity, but its bitcoin mining that is responsible.. 

[Thats according to this study funded by Ripple in collusion with the Department of Treasury. ](https://preview.redd.it/a4z5aqnyaxb81.jpg?width=1944&format=pjpg&auto=webp&s=6656489541bece07a0e9b83837d42345157f987c)... The same Department of Treasury headed by another well known Bitcoin hater Janet Yellen, who earned $7m as ""speaking fee"" from the same banks she is supposed to regulate but has tried to stifle Bitcoin and crypto at every opportunity. 

Research with ""financial support"" is nothing but propaganda, especially when it's funded by a competitor to bitcoin that lobbies with the government. Ripple continues to be a centralised premine scam created to enrich its founders. 

Ripple has also cozied up with the likes of WEF, the very organisations Bitcoin was created as a fuck you to. [https://www.weforum.org/organizations/ripple](https://www.weforum.org/organizations/ripple)

As its price and narrative around the shitcoin has stagnated, Ripple is resorting to dirty political tricks to get a leg up. As usual, they will fail. 

The narrative that bitcoin mining companies cause increase in electricity bills in NY is rubbish, as the largest BTC mining companies in New York produce their own energy. Infact the last one to start mining in NY is a hydro electric plant that was unused for years, before they started mining Bitcoin last year. 

[https://www.timesunion.com/news/article/Mechanicville-hydro-plant-gets-new-life-16299115.php](https://www.timesunion.com/news/article/Mechanicville-hydro-plant-gets-new-life-16299115.php)

The other large mining company Greenidge Generation also produces its own energy.


Edit: Buttcoin losers in comments say ""reee bitcoin move to POS or govt will ban it""

Yeah not too bright, the whole point of Bitcoin is that it cant be banned unlike the proof of stake shitcoins you support that can be created out of thin air at the press of a button and shut down at the press of a button.

Another one who is literally a war monger calling for Ukraine invasion but pretends to care about global e-waste. Lmao. Bitcoin haters are really a funny bunch


Edit: Ripple shills keep brigading and claiming where is the paper, of course if you are as bricked as a ripple fan boy you need to be spoon fed everything. Well here is the paper: https://papers.ssrn.com/sol3/papers.cfm?abstract_id=3779720

And if you open up the first page of it, says

> **Benetton and Compiani acknowledge financial support from Ripple’s University Blockchain Research Initiative.**

i.e this whole ""paper"" is nothing but a hit piece propaganda sponsored by a competitor

The other writer of this paper is Adiar Morse, who conveniently works for the Dept of Treasury under Yellen: 

https://newsroom.haas.berkeley.edu/prof-adair-morse-joins-biden-administration-as-a-treasury-department-deputy/

Seems like natural career progression - collect funds from Ripple to publish propaganda against Bitcoin, and get hired by Yellen who has been promoting propaganda against crypto for years now. Nothing to see here.

Final Edit: Jjust look at the number of freshly created ""Tin"" accounts that have popped up in the comments to shill for XRP. Didnt realize 2017 left so many bag holders. It must be real miserable with these heavy bags that are at 1/3rd of their 2017 ATH, while almost every other coin has gone up hundreds of % and made new highs this cycle. Thats what happens when you become exit liquidity for mccaleb, garlinghouse etc. 

Lol at the shills shouting ""REEE ripple is a company XRP is decentralised token"". They really did you good with this one small trick. 
Thats also the reason garlinhouse drives a shiny car while you are down 50% on your shitcoin investment. 

The D in XRP stands for decentralised. It was always a premined scam token and will always be one. Thousands of tin bagholders wont change this.",3881,https://www.reddit.com/r/CryptoCurrency/comments/s4vtk9/ripple_is_funding_propaganda_against_bitcoin_by/,1642284900.0
Bitcoin,"Bitcoin drops to $35.5K as 1,000 point Dow correction marks the worst trading day since 2020",,4830,https://cointelegraph.com/news/bitcoin-drops-to-35-5k-as-1-000-point-dow-correction-marks-the-worst-trading-day-since-2020/amp,1651820633.0
Bitcoin,"Shark Tank's Kevin O'Leary Reverses Stance on Bitcoin, Says Crypto Is Here to Stay, Invests 3% of His Portfolio",,12435,https://news.bitcoin.com/shark-tanks-kevin-oleary-bitcoin-cryptocurrencies-here-to-stay-invests-portfolio/,1614557559.0
Bitcoin,"Today one year ago Bitcoin briefly hit $3,760.86 during Black Thursday","Some prices from exactly one year ago during the Black Thursday crash. I remember being a bit worried but also buying as much as I could.

• BTC $3,760.86

• ETH $88.34

• LTC $24.92

• ADA $0.019255

• LINK $2.07

• XLM $0.029438

• XTZ $1.04

• BNB $6.93",8081,https://www.reddit.com/r/CryptoCurrency/comments/m3ef7q/today_one_year_ago_bitcoin_briefly_hit_376086/,1615542843.0
Bitcoin,"I bought Bitcoin in February at $48,000 and its still at $48,000. WTF. I thought this was a volatile market","Earlier this year I sold all my other investments to go all in on Bitcoin because I was told this is a volatile market and I won't have to wait long for good returns. I just looked at the price and its still at $48,000. That thing hasn't moved in over 6 months. Has Satoshi stopped the Bitcoin servers? WTF is going on? I guess I will go back to the stock market where we get real volatility. I once made +2.4% in the stock market in just 5 months, we sometimes get -5% drops but I guess the stock market isn't for the light hearted. Oh well what would you kids know about volatility",6970,https://www.reddit.com/r/CryptoCurrency/comments/pennoy/i_bought_bitcoin_in_february_at_48000_and_its/,1630347042.0
Bitcoin,"El Salvador To Buy an Estimated $135,000,000 Worth of Bitcoin.",,7999,https://dailyhodl.com/2021/06/27/el-salvador-to-buy-an-estimated-135000000-worth-of-bitcoin/?utm_source=coingecko&utm_content=coingecko&utm_campaign=coingecko&utm_medium=coingecko&utm_term=coingecko,1624824656.0
Bitcoin,"Bitcoin pullback mirrors 2020 reversal 250 days post-halving, it then rose 140%",,1364,https://cryptoslate.com/insights/bitcoin-pullback-mirrors-2020-reversal-250-days-post-halving-it-then-rose-140/,1734693365.0
Bitcoin,"Blackrock Now Holds Number 3 Spot among Top Bitcoin Holders with 429,112 BTC after a Staggering Purchase of 12,127 BTC in a Single Day",,897,https://i.redd.it/mlidztpsz9yd1.jpeg,1730460596.0
Bitcoin,"With Bitcoin At $60k, Satoshi Nakamoto Is Now One Of The 20 Richest People On The Planet",,8248,https://www.celebritynetworth.com/articles/billionaire-news/bitcoin-satoshi-nakamoto-20-richest/,1615780576.0
Bitcoin,$5.34 Billion in Bitcoin Withdrawn from Exchanges in 72 Hours,,1537,https://blockchainreporter.net/5-34-billion-in-bitcoin-withdrawn-from-exchanges-in-72-hours/,1733077839.0
Bitcoin,"Bitcoin and Ethereum Reaches New ATH at $62,914 and $2216 Respectively","The first time Bitcoin and Ethereum reach ATH at the same time in a long time.

Congratulation to all BTC and ETH holders who have held it through consolidation of long and hurtful month. It sucks when you see other coins pumping and BTC and ETH stays where it is but nothing hurts more than selling the coins you believe in to chase the coins that are pumping just to missed the pump of the coins you believe in. (been there done that)

Lets celebrate today and hope BTC and ETH can find footing above previous ATH. To infinity and beyond!!",7481,https://www.reddit.com/r/CryptoCurrency/comments/mpyby2/bitcoin_and_ethereum_reaches_new_ath_at_62914_and/,1618303841.0
Bitcoin,Donald Trump's 'Made in USA' Bitcoin is promise impossible to keep,,822,https://www.business-standard.com/world-news/donald-trump-s-made-in-usa-bitcoin-is-promise-impossible-to-keep-124122700424_1.html,1735344223.0
Bitcoin,The car is temporary - Bitcoin is forever,,1830,https://i.redd.it/79t7n5h2ul5e1.png,1733654932.0
Bitcoin,All roads eventually lead to Bitcoin,,1364,https://i.redd.it/126x8r8qr7be1.png,1736101380.0
Bitcoin,El Salvador buys the dip adding 100 Bitcoin to national treasury 🇸🇻,,6208,https://nitter.net/nayibbukele/status/1464307422793715716#m,1637953774.0
Bitcoin,Ripple is the biggest obstacle for a Strategic Bitcoin Reserve in the US.,,530,https://cryptoslate.com/ripple-is-the-biggest-obstacle-for-a-strategic-bitcoin-reserve-in-the-us-riot-vp/,1737661759.0
Bitcoin,10 years ago today Bitcoin flash crashed from $16 to $0.01 in a matter of minutes,,8494,https://blog.bitmex.com/the-june-2011-flash-crash-to-0-01/,1623527740.0
Bitcoin,"If you think bitcoin is only used by criminals, wait until you hear that banks help launder $2 trillion every year.",Bitcoin being used by criminals is still some of the most long-lived FUD out there. It is something that still often comes up today when I hear nocoiners talk about Bitcoin and is often cited as a reason not to invest.,11100,https://www.reddit.com/r/CryptoCurrency/comments/lvk7um/if_you_think_bitcoin_is_only_used_by_criminals/,1614631975.0
Bitcoin,Trump may use Bitcoin as US reserve asset on 'day one' — How high will BTC price go?,,817,https://cointelegraph.com/news/trump-bitcoin-us-reserve-asset-day-one-how-high-will-btc-price-go,1734432214.0
Bitcoin,Been buying bitcoin every month for almost 4.5 years,"Started in October 2017. Thought I was late, everybody does. Decided to buy as much bitcoin as possible. Basically this means buying from every paycheck as much as possible. It's the FIRE type of investing but replace S&P500 with bitcoin. It's been going pretty well, a couple of crashes here and there. If you manage to keep your emotions at bay, there's no better way of accumulating capital (and freedom in your life). I started to document my journey in this blog. Hopefully it gives you motivation to do something similar!

Enjoy:

[https://er-bybitcoin.com/stacking-em-volume-20-march-2022/](https://er-bybitcoin.com/stacking-em-volume-20-march-2022/)",4439,https://www.reddit.com/r/CryptoCurrency/comments/tdthqw/been_buying_bitcoin_every_month_for_almost_45/,1647250094.0
Bitcoin,"Media says ""It doesn’t matter where the Bitcoin wallet is—the FBI still can get access"". These are dishonest lies. Stop lying and fooling people, FBI & Media!","According to media reporters, FBI claims that it can get access to bitcoin stored anywhere. That is just impossible, unless somehow they have developed ways to crack SHA256 and brute force wallet private keys. In which case, BTC is the least of everyone's worries and state/nuclear secrets could be under risk. 

[While Bitcoin isn’t stored on a server, the private keys to unlock the Bitcoin may have been. In any event, an FBI official just told reporters that it doesn’t matter where the Bitcoin wallet is—the FBI still can get access. They won’t say how.](https://preview.redd.it/b2ctswfre1471.jpg?width=1182&format=pjpg&auto=webp&s=9f56cbffd28695d53010ea63cf3616b0c3bc1b27)

And clueless media reporters are taking this to the next level by parroting and amplifying these distorted narratives.

[FBI can empty anybody's wallet. ](https://preview.redd.it/d0eup9f8f1471.jpg?width=1204&format=pjpg&auto=webp&s=e03f7dcdcf2a0252d84ce4217308a5de524b181b)

What rubbish, if FBI can empty anyone's wallet they can get BTC from the top addresses and all become billionaires themselves. This is some of the weakest FUD but people still seem to be falling for this.


Edit: Lots of comments seem to suggest that governments are developing or have developed ""quantum computers"" that can crack/hack bitcoin private keys. While quantum computers can definitely become a threat to cryptocurrencies in the future, they are not presently anywhere close to being capable of deriving the private key for a bitcoin address. 

As per u/BreakingBaIIs : 

> I did a back-of-envelope calculation that showed that it would be faster to mine all the remaining bitcoins 6 billion times than it would to crack a single private key using brute force.

> If the FBI found a way to efficiently crack a private key, that would mean they solved the most important math problem humanity has ever faced, that P=NP (in the affirmative). What they could do would go far beyond breaking all of the Internet's security protocols (which they could do). They would be able to solve all the mathematical theorems that humanity has ever worked on for thousands of years, plus many new ones we never thought about, in a matter of days or hours. They would be able to efficiently create superhuman AI using modest computational resources.

The complexity of cracking a single BTC private key is large and currently not in existence. 

Moreover, if such a powerful computer existed, it would be a threat to several other things rather than bitcoin and crypto. The entire internet runs on cryptographic encryption. Nothing would be safe. In fact, someone in possession of much less powerful quantum computing power can easily hack into Federal reserve and transfer out every dollar there, or hack into Bank of England and shut everything down. In other words, cryptocurrencies would not even be among the top threats, because much bigger and important threats would be easily taken over. 

If they had quantum computers, they wont be asking Apple to de-encrypt devices seized from criminals. 

If they have quantum computers that can reverse engineer the private keys to any BTC address, they wont bother recovering measly 60 BTC from the 80 BTC ransom, when they can just send BTC to zero by hacking and moving Satoshi coins, thus destroying BTC's narrative completely. 

Tl:dr - Its preposterous to suggest anything like this exists. While it is true that research and development on quantum computers is an ongoing topic, there is no evidence to suggest that such a quantum computing system exists today that can derive BTC private keys from just the addresses.",6878,https://www.reddit.com/r/CryptoCurrency/comments/nv38cv/media_says_it_doesnt_matter_where_the_bitcoin/,1623156401.0
Bitcoin,"Bitcoin sign spotted: November 20, 2021. They were wrong 💀",,825,https://i.redd.it/hk220aq6112e1.png,1732101118.0
Bitcoin,You guys asked for it so here it is: I built a bot that buys Bitcoin when Elon Musk Tweets about it and open sourced it,"In my last post, you guys were interested in my bot project that buys Bitcoin when Elon tweets about it so here it is!

The bot was initially designed to buy Bitcoin when Elon Musk tweets about, regardless of the sentiment of the tweet. I have shared it with some smaller communities, and there was some great feedback on it regarding the main concern - what if Elon tweets: ""Bitcoin is too high imo"" and the bot buys at the wrong time.

So I found an API that would help me analyse the tweet sentiment, and integrated this into the code. The bot will now only buy Bitcoin when Elon Tweets, if the sentiment of his tweet is positive.

I have tested the functionality and the bot is quite stable, but I haven't tested how profitable (if at all) it would actually be, so if you're interested in testing it, please share the results with us! :)

The bot was built mostly for fun, and I wouldn't encourage you to trade with it on a live account! But if you want to have some fun with it and try it out on a demo account, here you go:

Article and guide: [https://www.cryptomaton.org/2021/03/21/program-a-trading-bot-to-buy-bitcoin-when-musk-tweets-about-it/](https://www.cryptomaton.org/2021/03/21/program-a-trading-bot-to-buy-bitcoin-when-musk-tweets-about-it/)

GitHub Repo: [https://github.com/CyberPunkMetalHead/bitcoin-bot-buy-if-elon-tweets/blob/main/buy-crypto-if-elon-mentions-crypto.py](https://github.com/CyberPunkMetalHead/bitcoin-bot-buy-if-elon-tweets/blob/main/buy-crypto-if-elon-mentions-crypto.py)

&#x200B;

**Update:**

**Wow, you guys are the best. I did not expect this to blow up like this!**

**Some of you suggested a Twitch channel for bots and I can't help but oblige, join me on Twitch in a few minutes as I will be live coding a simple trading bot!** [https://www.twitch.tv/cyberpunkmetalhead](https://www.twitch.tv/cyberpunkmetalhead)",9815,https://www.reddit.com/r/CryptoCurrency/comments/mflmpo/you_guys_asked_for_it_so_here_it_is_i_built_a_bot/,1617009994.0
Bitcoin,"MicroStrategy has acquired 2,138 Bitcoin for $209 million dollars and now holds a total of 446,400 BTC",,974,https://www.microstrategy.com/press/microstrategy-acquires-2138-btc-achieves-btc-yield-of-47-qtd-74-ytd-now-holds-446400-btc_12-30-2024,1735563905.0
Bitcoin,"News: ""Man uses Bitcoin to buy chemical weapon"" - I wonder if we'll start seeing ""Man uses USD to buy gun"" articles soon?",,10541,https://www.independent.co.uk/news/world/americas/bitcoin-chemical-weapon-man-prison-b1827867.html,1617804061.0
Bitcoin,Man who accidently threw away his computer filled with bitcoin has finally found it in the dump.,"After years of looking for his lost computer that he believed was filled with 7,500 bitcoins the man has found it.

the entire thing cost him around 2.5 million after paying for excavators, labor and city permits to dig up the landfill. He was relieved after finding the computer last month and had a professional data recovery company working on it for the last four weeks trying to recover his lost wallet, this cost alone was $400k.

Unfortunately it turns out the wallet was actually filled with bitcoin cash a hard fork of bitcoin worth a fraction of the price of actual bitcoin.

7,500 x $124 + $930k

so he is now about 1.6 million in debt to cover the cost of the loan he took out using the believed bitcoin as collateral.

&#x200B;

https://preview.redd.it/llaiy3xxc0ma1.jpg?width=1224&format=pjpg&auto=webp&s=3e0ec6ba15afd3fff9cc6a2e909286ac497fb856

you can see the look of defeat in his face.",2450,https://www.reddit.com/r/CryptoCurrency/comments/11ji1zw/man_who_accidently_threw_away_his_computer_filled/,1678060215.0
Bitcoin,"The Richest Bitcoin Whale in Existence Now Has Over $2,763,000,000 in BTC After Massive Series of Transactions",,4117,https://dailyhodl.com/2022/06/25/the-richest-bitcoin-whale-in-existence-now-has-over-2763000000-in-btc-after-massive-series-of-transactions/,1656216724.0
Bitcoin,"Bitcoin to $1M, Ethereum to $180,000 by 2030: ARK Report",,3679,https://cryptobriefing.com/bitcoin-1m-ethereum-180000-2030-ark-invest/?utm_source=main_feed&utm_medium=rss,1643208384.0
Bitcoin,"If You Can Hold a 401K Plan for 30-40 Years, You Can Hold Bitcoin for 3-4 Years.","You also only have to buy into BTC once, unlike a 401K where most people keep buying back in every pay check only to lose what you earned in interest by paying a penalty if you withdraw too early.   Because that's the trick.  The trick to a 401K is to get everyone to hold because if everyone sells, then everyone else who didn't sell fast enough will lose money and the whole thing will crash.    That's why they charge penalities.    

It's like investing in safemoon and they charge you penalities for selling In order to keep the current value more stable so the entirety of holders don't start panic selling it into oblivion.

Also you can panic sell a 401K too.  It happened to many people after the housing market crash of 2008.    My mom panic sold her 401k because it went from $50K to $9K ...I didn't know much about investing back then, but I will never forget what she said.  *I was afraid I would lose it all, it kept going down* 

What she said sounds much like what people say about Bitcoin today. 

Nowadays my mom is retired, and sometimes she brings that up...*I should've just kept it in...it went back up*

Unfortunately this is how the most powerful people work.  They shake out weak hands so they can buy up super low.   Otherwise there would be no big guy buying your shit back.  

Rich are buying your shit cheap for a reason...not just because they are just speculating. 


So yeah, you can get serious FUD with 401K and it's not just coming from my mom. Many honest hard working people don't understand the game whales play...they get shilled into things and are convinced it's safe because their employer offers it.    All a 401K is, is investments into stocks and bonds that are stable but not always safe. 

So if you can continually dump every paycheck into something that penalizes you for withdrawing early and hold that shit for 30 years , then you can buy Bitcoin  once and hold it for 3 years without any penality for withdrawing some too early unless tax on capital gains. But that's normal. 

So stick to your original plan, and hold.",6817,https://www.reddit.com/r/CryptoCurrency/comments/nns2bs/if_you_can_hold_a_401k_plan_for_3040_years_you/,1622308958.0
Bitcoin,Man who binned £1.5BN Bitcoin drive launches legal fight to dig dump,Computer expert who accidentally threw out Bitcoin fortune on an old hard drive says it is now worth £1.5BILLION as he launches legal fight to dig it out of council landfill,1323,https://www.dailymail.co.uk/news/article-13201007/Computer-expert-accidentally-threw-Bitcoin-fortune-old-hard-drive-says-worth-1-5BILLION-launches-legal-fight-dig-council-landfill.html,1710624437.0
Bitcoin,"11 Years ago, Michael Saylor compared Bitcoin to online gambling, today Saylor’s MicroStrategy owns 444,262 BTC worth $27.7B.",,1122,https://i.redd.it/yls3wjxkku8e1.jpeg,1735068205.0
Bitcoin,"MicroStrategy purchases another 11,000 BTC at $101,191 per Bitcoin",,1251,https://i.redd.it/260xl8bdlcee1.jpeg,1737465638.0
Bitcoin,The true power of Bitcoin 🔥,,14646,https://i.redd.it/h4n3169pq2531.jpg,1560845899.0
Bitcoin,Bitcoin price: $8. Legend 🔥,,1884,https://i.redd.it/ro69g69bcc3d1.png,1716977758.0
Bitcoin,"Banks consumed 520% more energy, released almost 6 times more CO2 than Bitcoin.",,7009,https://bitcoinmagazine.com/culture/comparison-of-bitcoins-environmental-impact,1620173930.0
Bitcoin,"Bitcoin Breaks Above $65,000",,2183,https://bitcoinist.com/bitcoin-price-breaks-above-65000-here-are-the-factors-behind-it/,1709547479.0
