Keyword,Title,Content,Score,URL,Created_UTC
Bitcoin,On February 9th 2011 Bitcoin first touched $1. Less than 14 years later Bitcoin has surpassed $100k. An increase of 10 Million percent. ,,7831,https://i.redd.it/m7ll0go40y4e1.png,1733366373.0
Bitcoin,"This Anonymous guy received $50 worth of Bitcoin back in 2012, HODLed through 13 Majestic Years, sold them for $1M in 2024 at $100k.",Imagine hodling for 13 Years,7419,https://i.redd.it/ogcetnacr76e1.jpeg,1733920323.0
Bitcoin,"Satoshi Era Bitcoin Whale moved 2,000 BTC for the First Time Since 2010, he held from $0.06 to $90,000",,5942,https://i.redd.it/foyzxsppw41e1.jpeg,1731706570.0
Bitcoin,"A solo miner today mined a Bitcoin Block all by himself, claiming 3.195 BTC ($311,432) in reward.","Solo Ck Mining Node.

Block: 875750

Total fees: 0.07 BTC ($6,785)

Subsidy + fees: 3.195 BTC ($311,432)

Timestamp: 2024-12-21",5929,https://i.redd.it/x72s6ypvff8e1.jpeg,1734885021.0
Bitcoin,"Man narrows landfill search for $771 million Bitcoin hard drive with ""finely tuned"" plan",,3791,https://www.techspot.com/news/105839-man-narrows-landfill-search-771-million-bitcoin-hard.html,1733428638.0
Bitcoin,"$1.47B liquidated from the Crypto Market in last 24hrs as Bitcoin dips $94k, alts go into free fall",,3239,https://i.redd.it/jz3tvdzz4w5e1.jpeg,1733779634.0
Bitcoin,"Bitcoin has followed a consistent 4-year cycle For the Past 14 Years, Based on this pattern, we’re now at the beginning of an exponential growth phase.",,3567,https://i.redd.it/95px1ns8in0e1.jpeg,1731495886.0
Bitcoin,Bitcoins Officially Hits $100.000 For The First Time Ever,,3869,https://bitcoinmagazine.com/markets/bitcoin-officially-hits-100000-for-the-first-time-ever,1733367189.0
Bitcoin,Bitcoin Maxis in shambles right now,,4119,https://i.redd.it/8009ylptr1ee1.png,1737334646.0
Bitcoin,"El Salvador’s Bitcoin holdings reached $531 million, gaining $263 million in unrealized profit, President Nayib Bukele says “I told you so”.",,5667,https://i.redd.it/l2uax579jf0e1.jpeg,1731399370.0
Bitcoin,"After 12 years of unsuccessful attempts, the man who lost his hard drive containing 742 million dollars in Bitcoin is forced to give up",,3562,https://indiandefencereview.com/after-12-years-of-unsuccessful-attempts-the-man-who-lost-his-hard-drive-containing-742-million-euros-in-bitcoin-is-forced-to-give-up/,1737489723.0
Bitcoin,Ethereum falls to 4-year low against Bitcoin as BTC breaks above $94k,,2755,https://cryptoslate.com/insights/ethereum-falls-to-4-year-low-against-bitcoin-as-btc-breaks-above-94k/,1732112845.0
Bitcoin,"Jim Cramer says: “All I can tell you is own Bitcoin, that’s a winner”",,2040,https://v.redd.it/n9ebzt1t0h2e1,1732289077.0
Bitcoin,Bitcoin is just 2% away from breaking its all-time high,,3575,https://finbold.com/bitcoin-is-just-2-away-from-breaking-its-all-time-high/?utm_source=CryptoNews&utm_medium=app,1730227781.0
Bitcoin,"Bitcoin Founder Satoshi Nakamoto Overtook Michael Bloomberg As 16th Richest Person When BTC Hit $106k, Closed In On Bill Gates",,3263,https://thebittimes.com/bitcoin-founder-satoshi-nakamoto-overtook-michael-bloomberg-as-16th-richest-person-when-btc-hit-106k-closed-in-on-bill-gates-tbt107239.html,1734460402.0
Bitcoin,World's Largest Bitcoin (BTC) Mine Nears Completion: Riot Blockchain's 1-Gigawatt Facility in Texas,,1911,https://www.reddit.com/gallery/1hufx0t,1736107698.0
Bitcoin,This website gave away 5 free Bitcoin to everyone who completed a simple CAPTCHA back in 2010.,"

And his way of explaining it: 

""What are Bitcoins?


Bitcoins are a new kind of money. They aren't created or controlled by a govemnment (like dollars or euros), they're
created and controlled by anybody who wants to be part of the Bitcoin payment network. Visit the Bitcoin.org website for all the geeky details.


How do I get a Bitcoin Receiving Address?


Download and install the Bitcoin program from www.biticoin.org. At the top of its main window it will show you Your Bitcoin Address.


I've got Bitcoins; how can I help?


Send them to the Bitcoin Faucet and they'll be given away. It may take up to 30 minutes for your donation to be added to the amount available


What's the catch?


No catch- want Bitcoin to be successful, so 1 created this Ittle service to give you a few coins to start with.

gavin""

[source](https://x.com/DocumentingBTC/status/1874622604537167988?t=aV_EHFFSpzlO9i7dN7PPfg&s=19)",3291,https://i.redd.it/7kos3gechiae1.jpeg,1735793529.0
Bitcoin,Satoshi Bitcoin wallets now worth over $100 billion making Top 20 richest people,,2661,https://cryptoslate.com/insights/satoshi-bitcoin-wallets-now-worth-over-100-billion-making-top-20-richest-people/,1731590430.0
Bitcoin,Bitcoin (BTC) is always boring before it goes parabolic,,1800,https://www.reddit.com/gallery/1hxogvz,1736459910.0
Bitcoin,Saylor vows to destroy Bitcoin keys upon death as a gift to global holders,,1946,https://www.cryptopolitan.com/saylor-to-destroy-bitcoin-keys-upon-death/,1736085742.0
Bitcoin,"El Salvador Continues to Purchase 1 Bitcoin Every Single day, Since President Nayib Bukele Announced on 16 Nov 2022, total holdings stand at staggering 5.948k BTC ($568M).",,2815,https://i.redd.it/recxnkvi3n3e1.jpeg,1732798479.0
Bitcoin,Bitcoin spot ETF finally approved,,5420,https://www.sec.gov/files/rules/sro/nysearca/2024/fg-89shlq.pdf,1704919499.0
Bitcoin,"This guy got kicked off Kraken for saying I might invest more than 10% in Bitcoin this year, UK Government trying to keep its citizens poor.",,1274,https://www.reddit.com/gallery/1htexdp,1735999177.0
Bitcoin,Imagine selling 100 Bitcoins today...,,2749,https://i.redd.it/e9rdksj5jaae1.png,1735697282.0
Bitcoin,Man who begged everyone to buy just $1 of Bitcoin in 2013 revealed what his life looks like now,,3258,https://www.unilad.com/technology/news/man-begged-buy-bitcoin-now-super-rich-393645-20240401,1724395033.0
Bitcoin,"Bitcoin Nears $98,000, Just 2% Away From Six Figures ",,2159,https://cryptopotato.com/bitcoin-nears-98000-just-2-away-from-six-figures/,1732166217.0
Bitcoin,"Ancient Bitcoin Whale transfers 357.4 BTC after 11yrs, he received these BTC back in 2014 when price was around $1k, the current value skyrocketed to $33.97M.", Bitcoin Address: 1MLAeu3LmDrMitsEex8wZBSrFwjk6kBXme,2177,https://i.redd.it/evq3geidjt9e1.jpeg,1735491539.0
Bitcoin,AOC reveals she doesn't hold bitcoin because she wants to be an unbiased lawmaker,,38850,https://markets.businessinsider.com/news/currencies/aoc-bitcoin-crypto-investment-unbiased-lawmaker-house-financial-services-committee-2021-12,1638885832.0
Bitcoin,"Elon bragging about his ""diamond hands,"" exactly 3 years ago. He's since sold $2 billion worth of Bitcoin 💀",,3736,https://i.redd.it/u2roytdq7d1d1.png,1716116828.0
Bitcoin,Was that the Last chance to buy Bitcoin under $100k?,,1578,https://i.redd.it/ikngegpi147e1.jpeg,1734311166.0
Bitcoin,Bitcoin Breaks Down $20K: Now Below 2017’s Previous All-time High,,15707,https://cryptopotato.com/bitcoin-breaks-down-20k-crashes-below-2017s-previous-all-time-high/,1655536140.0
Bitcoin,"Reddit user found Old Wallet with 1.85 Bitcoins which his friend traded for Audi back in 2016/2017, completely forgotten about it for 7 years.",,2196,https://www.reddit.com/gallery/1hqo4jv,1735679441.0
Bitcoin,Donald Trump’s Cryptocurrency Advisory Council is Expected to Establish the Promised US Bitcoin Strategic Reserve,,1828,https://en.bitcoinsistemi.com/breaking-donald-trumps-cryptocurrency-advisory-council-is-expected-to-establish-the-promised-us-bitcoin-strategic-reserve-according-to-reuters/?utm_source=CryptoNews&utm_medium=app,1732364161.0
Bitcoin,Google Removes Bitcoin and Crypto Price Charts from Search,,1894,https://www.cryptotimes.io/2024/10/14/google-removes-bitcoin-and-crypto-price-charts-from-search/,1728913501.0
Bitcoin,Edward Snowden Offers To Become Twitter's CEO In Exchange For Bitcoin Pay,,10112,https://moneywreckers.com/edward-snowden-offers-to-become-twitters-ceo-in-exchange-for-bitcoin-pay/,1671440349.0
Bitcoin,I hope people can see whats happening with US based cryptos and Bitcoin,"Crypto investor since 2017, made good money, enough to quit my job in my mid 30s and travel and start a business and do other things I want with my life. Doesnt mean I know anything.

It is my belief that at some point, just like every other market, there will be a bust/selection period where 99% of projects become worthless. Of the remaining survivors, maybe 5-6 take up 80-85% of the market share, 5-6 take up 5-10% and the remaining hundreds or thousands of coins make up the last 5-10%

Example: Theres Verizon, Att, T mobile at the top, then theres tracfone and boost and mint mobile, then theres 100 that nobody knows anything about. There are 100s of brands of batteries but very few companies who actually make the batteries. Tons of tv companies, 5-6 that people know, dozens that we dont, 100s of other ones, and only a handful of huge manufacturers that make everyones tvs at the same place.

This is what will happen IMO because it always does, since forever.

And while I dont really care if youre a fan of the US or not, the US is the strongest economy in the world, and it is in the best position to harness this and benefit from it and control the direction of the space in the US and global narrative. Im not saying this is the best for crypto or the world, but I think it's ignorant to outright say it wont matter.

With the US and other countries getting on board with a strategic reserve, its clear bitcoin is and will continue to be a winner for the foreseeable future.

I believe this is also why we have the Dino/US coins pumping as their leaders have recently all been meeting together with some of them like Hoskinson even getting involved directly with legislators, meeting with senators, getting in front of congress and talking about what is best for us. Founders have all recently met, are all ISO 20022 compliant, and are all going nuts. I think this is a winning recipe for this cycle and for the future and I just want people to be aware of it. These projects **XLM XRP ADA HBAR ALGO** are outperforming a lot of other coins and I believe this is why, despite people starting to call them all irrelevant before this happened.

I am saying this because this is my third cycle in the space and have wasted time and money looking for pumpy coins when if I had just kept my money where I had it 7 years ago in these Dino coins (in XRP and ADA anyways), id have been proven right in my early conviction of these projects. Look at the narrative, research it, and make an educated guess. Do not ignore these trends and its ok to take risks on meme coins with a little bit of your portfolio but make sure you are on the right side of history when it all shakes out, because it will at some point in the not so distant future.",1175,https://www.reddit.com/r/CryptoCurrency/comments/1h2vzcp/i_hope_people_can_see_whats_happening_with_us/,1732914715.0
Bitcoin,Elon Musk: Tesla stops accepting Bitcoin as payments. Looking at other Cryptocurrencies that use less energy,"[Elon Musk latest Tweet](https://ibb.co/60xctB8)

On Wednesday Night, Elon Musk tweeted:

Tesla has suspended vehicle purchases using Bitcoin. We are concerned about rapidly increasing use of fossil fuels for Bitcoin Mining and transactions, especially coal, which has the worst emissions of any fuel.

Cryptocurrency is a good idea on many levels and we believe it has a promising future, but this cannot come at a great cost to the environment. 

Tesla will not be selling any Bitcoin and we intend to use it for transactions as soon as mining transitions to more sustainable energy. We are also looking at other Cryptocurrencies that use <1% of Bitcoin's energy/transaction",27291,https://www.reddit.com/r/CryptoCurrency/comments/nb0yz5/elon_musk_tesla_stops_accepting_bitcoin_as/,1620857699.0
Bitcoin,"Ancient Bitcoin Whale who mined thousands of BTC, starting only 5 days after the first block in 2009 Sold USD 9.68M BTC in total and has USD 72.09M BTC remaining",,1637,https://i.redd.it/zlnnbo2pvaxd1.jpeg,1730035476.0
Bitcoin,Ethereum just hit a brand new 3.5 year low against Bitcoin. ,"ETH just hit a brand new 3 and a half year low against BTC after touching .03462 beating it's last 3 and a half year low of .03465 set just 8 days ago on Nov. 06th 2024. (.03462 means 1 eth is worth 3.46% of 1 BTC. )

In fact this means ETH has wiped all out gains against BTC since April 2021 when ETH was \~2k and BTC was around \~$60k. Since then ETH has completed the merge moving it from POW to POS and Proto-Danksharding (which dropped the gas cost on L2s). Still in comparing it's value against BTC, ETH has officially lost all of it's bear market gains.

[https:\/\/www.coingecko.com\/en\/coins\/ethereum\/btc](https://preview.redd.it/d2gwy67eax0e1.png?width=930&format=png&auto=webp&s=f1797ed2c0843594037ab12f5d8b26ad9a0ba558)

What you might not know is ETH is not alone lots of alts continue to be down against BTC.

Chainlink to BTC is also sitting at a 5 and a half year low.

[https:\/\/www.coingecko.com\/en\/coins\/chainlink\/btc](https://preview.redd.it/ku1r1nkndx0e1.png?width=986&format=png&auto=webp&s=71bed011d770afdf8158f46b5178b18dd0594f49)

Perhaps one of the worst performing alts and sub darling, DOT continues to hover near an ATL against BTC.

[https:\/\/www.coingecko.com\/en\/coins\/polkadot\/btc](https://preview.redd.it/k14atxujex0e1.png?width=948&format=png&auto=webp&s=e8b9f0f20a8ebf5ead8cfb60fb7f892d922762cb)

This list is not comprehensive but many alts are barely above recent bear market lows.

Just for fun I'll also include the Moon to BTC Chart which isn't great but is somehow better looking than a lot of the alts. 

[https:\/\/www.coingecko.com\/en\/coins\/moon\/btc](https://preview.redd.it/ogsd6930hx0e1.png?width=952&format=png&auto=webp&s=19b9d221c0d5da03c564ca2e35ba6e15a68642ed)

",1215,https://www.reddit.com/r/CryptoCurrency/comments/1greczo/ethereum_just_hit_a_brand_new_35_year_low_against/,1731616027.0
Bitcoin,"Mark Cuban saying he'd buy bananas over Bitcoin, 5 years ago. Bitcoin is up 6x since 💀",,1427,https://i.redd.it/32ptwvxvjqsd1.png,1728046019.0
Bitcoin,Bitcoin is the king…,,1323,https://i.redd.it/6hwvszdqtsbe1.jpeg,1736354612.0
Bitcoin,Elon Musk's Tesla Just Moved $765 Million in Bitcoin to Unknown Wallets,,2129,https://decrypt.co/286456/elon-musk-tesla-moves-bitcoin,1729034875.0
Bitcoin,"YouTube just terminated Bitcoin Magazine's account that was active since 2011, providing educational and informative content. Meanwhile BitBoy continues to scam others on YouTube and even has a verified account. Pathetic","Bitcoin Magazine's youtube account that has been around since 2011 just got nuked by Youtube

[https://www.youtube.com/channel/UCtOV5M-T3GcsJAq8QKaf0lg](https://www.youtube.com/channel/UCtOV5M-T3GcsJAq8QKaf0lg)

[Bitcoin Magazine](https://preview.redd.it/ess5t73m34b81.jpg?width=1330&format=pjpg&auto=webp&s=61777d9442bb83f87477da4a1f3b277e6f8015f5)

The account has 1.9 Million followers on Twitter and 60,000 on YouTube.

[Account taken down midstream](https://preview.redd.it/dy82as6r34b81.jpg?width=1306&format=pjpg&auto=webp&s=89d4e2c1c2706c59046d665d19f4aecb937f2cf4)

Youtube has made it a habit of taking down prominent informative accounts, while the likes of bitboy and other scammers continue to scam others via the youtube platform. Bitboy even has a verified account.

Google has openly been supporting crypto scams, even fake phishing wallets show up in google search instead of domains of the actual wallets",14686,https://www.reddit.com/r/CryptoCurrency/comments/s1lnoy/youtube_just_terminated_bitcoin_magazines_account/,1641930300.0
Bitcoin,Bitcoin millionaire who retired at 35 complains that being rich is 'boring',,6151,https://www.dailystar.co.uk/news/weird-news/bitcoin-multi-millionaire-who-retired-28691630,1670578099.0
Bitcoin,"Bitcoin has never retraced below its election-day price after the results are in, Historically BTC explodes post-U.S. elections, often going parabolic.",,1396,https://i.redd.it/r22lumkfkvyd1.jpeg,1730721780.0
Bitcoin,Trump Confirms Bitcoin Reserve Plans—$15 Trillion Price Boom Predicted,,1267,https://www.forbes.com/sites/digital-assets/2024/12/14/trump-confirms-bitcoin-reserve-plans-15-trillion-price-boom-predicted/?utm_source=coingecko&utm_content=coingecko&utm_campaign=coingecko&utm_medium=coingecko&utm_term=coingecko,1734217404.0
Bitcoin,Jack Mallers: Ripple Is Spending Millions to Undermine Strategic Bitcoin Reserve,,980,https://news.bitcoin.com/jack-mallers-ripple-is-spending-millions-to-undermine-strategic-bitcoin-reserve/,1737887288.0
Bitcoin,Bitcoin wallet rejects Canada’s Court demand to freeze funds citing technically impossible,,11266,https://finbold.com/bitcoin-wallet-rejects-canadas-court-demand-to-freeze-funds-citing-technically-impossible/,1645454875.0
Bitcoin,"Why Bitcoin's Rally Is Stalling Below $100,000 ",,1177,https://www.benzinga.com/markets/cryptocurrency/24/11/42163156/why-bitcoins-rally-is-stalling-below-100000,1732545117.0
Bitcoin,Bitcoin sudden drop to $93K wipes out $303M of longs within minutes,,1893,https://cointelegraph.com/news/bitcoin-plummets-btc-price-longs-liquidated,1733448651.0
Bitcoin,"13 years ago today, a $110 million Bitcoin mistake ✨",,3686,https://i.redd.it/x3vnyx20or0d1.png,1715856759.0
Bitcoin,"President of El Salvadore on twitter: No Capital Gains taxes to be paid for Bitcoin, and Permanent Residence (greencards) will be granted for crypto entrepeneurs!",,18776,https://twitter.com/nayibbukele/status/1401622548396314631,1623030783.0
Bitcoin,"In 2013 Wired magazine called Bitcoin daydreaming, erased their wallet keys, and are now unable to access 13.34 BTC.","This is just to show how we have come a long way from 2013. Or have we?

Not all of those who were ""early"" knew what the future would bring and there has always been a huge amount of uncertainty around. I wouldn't even dare to amount the people who have lost their keys during this time. It seems that even when you are uncertain of things you should never burn all of the bridges.

>But in the end, the answer was obvious. The world's most popular digital currency really is nothing more than an abstraction. So we're destroying the private key used by our Bitcon wallet. That leaves our growing pile of Bitcoin lucre locked away in a digital vault for all eternity – or at least until someone cracks the SHA-256 encryption that secures it.

Source: [Link](https://www.wired.com/2013/05/butterfly-live/)

Wallet:  [1BYsmmrrfTQ1qm7KcrSLxnX7SaKQREPYFP](https://www.blockchain.com/btc/address/1BYsmmrrfTQ1qm7KcrSLxnX7SaKQREPYFP)

Edit: Some of you guys were asking if they ever made an update, thanks u/mutso1976 for this [LINK](https://www.wired.com/story/wired-lost-bitcoin/) (2018)",10183,https://www.reddit.com/r/CryptoCurrency/comments/r6djn0/in_2013_wired_magazine_called_bitcoin_daydreaming/,1638361314.0
Bitcoin,Bitcoin Reaches A New All-Time High At $75K,,1758,https://blockzeit.com/breaking-news-bitcoin-reaches-a-new-all-time-high-at-75k/,1730890215.0
Bitcoin,"Bitcoin price breaks $69,000",,2737,https://www.thestreet.com/crypto/markets/bitcoin-price-breaks-69000-all-time-high-whats-next,1709651132.0
Bitcoin,The President of El Salvador just announced that he is making Bitcoin legal tender in his country.,"The President of El Salvador just announced that he is making Bitcoin legal tender in his country.

This is the first country to take such a courageous step, but it won’t be the last

Today, the country of El Salvador has taken one small step for bitcoin, but a giant step forward for humanity.

Bitcoin is inevitable.

Edit: This is a proposed bill to adopt bitcoin as the legal tender. Bitcoin will be the currency of El Salvador once this bill is passed. 

Thanks u/Cintre for the addition!",18211,https://www.reddit.com/r/CryptoCurrency/comments/nt531l/the_president_of_el_salvador_just_announced_that/,1622926324.0
Bitcoin,Trump meets with Crypto.com CEO to discuss Bitcoin reserve and crypto appointments,,1569,https://cryptobriefing.com/trump-crypto-appointments-meeting/,1734598671.0
Bitcoin,The panic you are experiencing now is exactly why you wouldn’t have held bitcoin if you had bought it at less than a dollar in 2009.,"If you believe in crypto you are in it longterm. For those that are exiting, just know you would have never held until now had you bought at sub dollar prices.

You can only beat the algorithm and high frequency traders if you hold longterm. Crypto is a long play.",17153,https://www.reddit.com/r/CryptoCurrency/comments/ng5uwx/the_panic_you_are_experiencing_now_is_exactly_why/,1621430920.0
Bitcoin,MEGATHREAD: Tesla buys $1.5 billion in bitcoin and plans to start accepting it as payment for products,"Tesla announced in an SEC filing Monday that it bought $1.5 billion worth of bitcoin. 


The company also said it would start accepting bitcoin as a payment method for its products. 


CEO Elon Musk has been credited for raising the prices of cryptocurrencies, including bitcoin, through his messages on Twitter.



https://www.cnbc.com/2021/02/08/tesla-buys-1point5-billion-in-bitcoin.html


Link to SEC Filing: https://www.sec.gov/ix?doc=/Archives/edgar/data/1318605/000156459021004599/tsla-10k_20201231.htm


> In January 2021, we updated our investment policy to provide us with more flexibility to further diversify and maximize returns on our cash that is not required to maintain adequate operating liquidity. **As part of the policy, which was duly approved by the Audit Committee of our Board of Directors, we may invest a portion of such cash in certain alternative reserve assets including digital assets**, gold bullion, gold exchange-traded funds and other assets as specified in the future. Thereafter, we invested an aggregate $1.50 billion in bitcoin under this policy and may acquire and hold digital assets from time to time or long-term. Moreover, we expect to begin accepting bitcoin as a form of payment for our products in the near future, subject to applicable laws and initially on a limited basis, which we may or may not liquidate upon receipt. **We believe our bitcoin holdings are highly liquid. However, digital assets may be subject to volatile market prices, which may be unfavorable at the time when we want or need to liquidate them.**





Other sources:

https://www.bloomberg.com/news/articles/2021-02-08/tesla-invests-1-5-billion-in-bitcoin-plans-to-accept-cryptocurrency


https://techcrunch.com/2021/02/08/tesla-buys-1-5b-in-bitcoin-may-accept-the-cryptocurrency-as-payment-in-the-future/",19001,https://www.reddit.com/r/CryptoCurrency/comments/lfbslm/megathread_tesla_buys_15_billion_in_bitcoin_and/,1612790970.0
Bitcoin,Bitcoin Pumps and then dumps after the SEC Twitter account is compromised and posts a fake announcement saying a spot ETF was approved.,"Something wild just happened. THE SEC posted a tweet saying that the Spot ETF was approved.

https://preview.redd.it/da39fq45ihbc1.png?width=1271&format=png&auto=webp&s=fd7526663d53ce3ffe2e9a10475d23571720137e

Bitcoin Spiked and then dumped, normal sell the news market volatility... right?

https://preview.redd.it/zzzh7es6hhbc1.png?width=1001&format=png&auto=webp&s=ccf15d1077653b4b6ec2287962aab4ea03ac8ef8

Nope apparently the ETF was never approved a follow up tweet by Gary Gensler said the SEC twitter account was compromised and that it was an unauthorized Tweet.

https://preview.redd.it/ly4qyay9hhbc1.png?width=1290&format=png&auto=webp&s=defaf4cc64e3145ab70cb1be761d9edcb87edd7f

The SEC announcement post is now deleted.

\-------------

With that lets acknowledge this SEC tweet from Oct. 2023.

https://preview.redd.it/2xybogscnhbc1.png?width=617&format=png&auto=webp&s=e8f2f2e092a99c957f9825264853c1e64b5dbf42

I have a feeling if this wasn't an intern screwup - whoever made that fake announcement likely made huge money on volatility...

Regardless of what happens on the supposed announcement later this week, this is going to be a stain on the inevitable news.",2338,https://www.reddit.com/r/CryptoCurrency/comments/192qh06/bitcoin_pumps_and_then_dumps_after_the_sec/,1704836403.0
Bitcoin,"Amazon To Integrate Bitcoin Payments And Launch Its Own Token By 2022, Insider Confirms",,13335,https://bitcoinist.com/amazon-to-integrate-bitcoin-payments-and-launch-its-own-token-by-2022-insider-confirms/?utm_source=rss&utm_medium=rss&utm_campaign=amazon-to-integrate-bitcoin-payments-and-launch-its-own-token-by-2022-insider-confirms,1627225603.0
Bitcoin,"If You Bought Bitcoin in December 2017, You Have Now Lost Money",,5322,https://futurism.com/the-byte/bitcoin-2017-now-lost-money,1668021261.0
Bitcoin,"A week after Bitcoin went live in 2009, Hal Finney predicted each bitcoin a value of about $10 Million.",,1352,https://i.redd.it/25kk0adpum8e1.jpeg,1734974753.0
Bitcoin,El Salvador just bought 410 Bitcoins.,"Yes, Nayib Bukele has just announced that El Salvador just bought an aditional 410 Bitcoins, for a total of 15,000,000 USD.

&#x200B;

[Nayib Bukele Tweet.](https://preview.redd.it/k1n842gqb4d81.png?width=742&format=png&auto=webp&s=c561b4fe99afe4235ea1712c0c0afe9a9f00f7e0)

When you have an actual country (El Salvador) buying the dips, that's a saying on what's to come. We might be watching on of the richest countries of the world on the upcoming years under construction, and maybe one of the smartest financial moves that a country has ever made. 

Price is changing but Bitcoin fundamentals are strong, and hasn't changed, keep stacking those sats if you can. I have a strong conviction on Bitcoin for the future, this is only getting started.",6601,https://www.reddit.com/r/CryptoCurrency/comments/s9n1q3/el_salvador_just_bought_410_bitcoins/,1642804717.0
